id,text
2019-17-4-3,"Впервые  <Contrib> формулируются прямая и обратная задачи электрического каротажа об  <Task> определении компонент тензора электрической анизотропии горных пород по комплексу измерений методами бокового каротажного зондирования и бокового каротажа в нефтегазовых скважинах </Task>  </Contrib> .  <Contrib> Рассматриваются особенности конечно элементной аппроксимации прямой задачи </Contrib> , использующей  <Method> базисные функции большого порядка </Method> .  <Contrib> Исследуется возможность восстановления горизонтальной и вертикальной составляющих удельного электрического сопротивления, а также угла наклона главных осей тензора электрической анизотропии </Contrib> ."
2019-17-4-4," <Contrib> Предложен подход к  <Task> разработке состава и структуры Интернет-ресурса </Task>  на основе  <Tool>  онтологии  </Tool>  предметной области  </Contrib> .   <Contrib> Описана предметная область, связанная с распространением клещей и переносимыми ими заболеваниями </Contrib>  ,   <Contrib> представлена ее семантическая структура  </Contrib> ,   <Contrib> выделены основные разделы информационного наполнения  </Contrib>  и  <Contrib> показаны способы навигации по ресурсу </Contrib> ."
2019-17-4-5,"Статья посвящена  <Contrib> разработке методов  <Task> извлечения речевых действий из текстов естественного языка </Task>  </Contrib> . В настоящее время одной из наиболее важных проблем является проблема  <Task> создания человеко-машинных интерфейсов </Task> . В данной работе рассматривается задача  <Task> построения подобных интерфейсов путем автоматизированного извлечения речевых действий из текстов естественного языка </Task> . Использование речевых действий позволяет задавать контекст диалога и уточнять смысл употребляемых понятий. По результатам исследования была  <Contrib> разработана программная система, которая способна определять типы речевых действий, представленных в текстах естественного языка </Contrib> . Одно из возможных применений результатов данного исследования заключается в использовании разработанной программной системы при  <Use> создании чат-ботов </Use> ."
2019-17-4-6,"Статья посвящена проблеме  <Task> проверки алгоритмов управления, созданных в рамках процесс-ориентированного подхода, на соответствие входным спецификациям </Task> .  <Contrib> Представлена общая схема верификации алгоритма управления </Contrib> , приведены ее реализация в автоматизированном варианте и результаты практической апробации в проекте по  <Use> автоматизации Большого солнечного вакуумного телескопа </Use> ."
2019-17-4-7,"Рассматривается вопрос  <Task> ускорения численного расчёта распространения волны цунами от очага до берега в рамках дифференциальной модели мелкой воды </Task>  с применением  <Method> аппаратного ускорения на базе FPGA </Method> .  <Contrib> Разработана программная архитектура для расчета системы мелкой воды без учёта внешних сил </Contrib> , являющейся эквивалентной используемой в пакете MOST для численного моделирования движения волны цунами по водной акватории. Численная реализация системы мелкой воды осуществлялась по  <Method> схеме Мак-Кормака </Method> . Точность вычислений разработанного решателя была проверена сравнением с точным решением, известным в случае плоского наклонного дна.  <Adv> Достигнутая точность не уступает, а местами и превосходит точность известного программного пакета MOST </Adv> ."
2019-17-4-8,"Статья посвящена  <Task> применению рассуждений на основе прецедентов (case-based reasoning, CBR) в области web-разработки </Task> . Учитывая собственный практический опыт в данной сфере, автор предлагает  <Goal> автоматизировать составление html/css-макета </Goal>  путём  <Method> агрегирования прецедентов кода из предыдущих опытов </Method> , что на методологическом уровне крайне близко к подходу CBR, а именно:  <Contrib> предлагается методика конструирования систем, генерирующих html-код из растрового изображения </Contrib>  и основанных на <Method>  подходе рассуждений на основе прецедентов </Method> . В частности, в статье  <Contrib> изложена оригинальная теория составления структуры изображения </Contrib>  и  <Contrib> описан алгоритм получения такой структуры </Contrib> . Кроме того, рассматривается  <Method> модификация подхода case-based reasoning </Method> , которая позволяет получить требуемый результат решения поставленной задачи. Также описываются результаты прохождения экспериментов разработанной системы в определённых условиях."
2019-17-4-9,"Современные портативные приборы для электромагнитного профилирования и малоглубинного зондирования позволяют изучать распределение удельного электрического сопротивления грунта. К типичным сферам применения подобных комплексов можно отнести: <Use>  исследование археологических объектов – курганы, древние поселения </Use> ;  <Use>  решение экологических задач – изучение отвалов и хвостохранилищ горнодобывающих предприятий, зон распространения вредных веществ </Use>  ;  <Use>  локализация инженерных объектов – труб и коммуникаций </Use>  ,  <Use>  исследование состояния дамб и плотин </Use>  . Перспективной сферой являются объекты агропромышленного комплекса –  <Use>  оценка плодородности почв (распределение минерализации) </Use>  ,  <Use>  контроль эффективности мелиорации </Use>  . Целью проводимых исследований является  <Goal> разработка и создание переносного программно-аппаратурного комплекса электромагнитного профилирования, позволяющего с высокой достоверностью и точностью обнаруживать и дифференцировать по удельному электрическому сопротивлению объекты различного рода </Goal> . На основании  <Method> оригинального принципа компенсации первичного поля генераторной катушки </Method>  была  <Contrib> разработана компактная многочастотная аппаратура для электромагнитного профилирования </Contrib> . В результате прототипирования  <Contrib> создана оптимальная конструкция корпуса, позволяющая реализовать данный принцип компенсации </Contrib> . Для эффективного использования аппаратурного комплекса было  <Contrib> создано программное обеспечение QZond </Contrib> , позволяющее управлять процессом сбора информации и в режиме реального времени визуализировать полученные данные. Проведенные полевые испытания на известных объектах электрометрического полигона ИНГГ СО РАН, при  <Use> поиске локальных и протяженных проводников </Use> , а также  <Use> археолого-геофизические исследования  </Use>  показывают  <Adv> эффективность реализации компактной аппаратуры электромагнитного профилирования </Adv> ."
2019-17-4-10,"Представлена реализация  <Method> подхода «модельно-ориентированного проектирования» </Method>  для решения задачи  <Task> создания автоматизированных систем управления технологическими процессами (АСУ ТП) горнодобывающих предприятий </Task> .   <Method> Подход «модельно-ориентированного проектирования»  </Method>  заключается в организации контура тестирования, в котором испытуемый объект функционирует в среде, идентичной реальному процессу по входным сигналам. Подход основан на  <Method> использовании математических моделей, имитирующих протекание технологического процесса под управлением АСУ ТП </Method> . Математические модели используются для формирования наборов тестовых данных.  <Contrib> Разработан имитационный программно-аппаратный комплекс </Contrib> . Основными частями комплекса являются: рабочая станция оператора SCADA, рабочая станция оператора модели, среда передачи данных, блок формирования физических сигналов, блок дублирования физических сигналов и программируемые логические контроллеры АСУ ТП. В качестве среды имитационного моделирования применена  <Tool> система MTSS </Tool> .  <Contrib> Предложен и реализован вариант развития способа Hardware-in-the-loop </Contrib> , обеспечивающего создание совместимых компонентов систем автоматизации. Приведено описание методики тестирования АСУ ТП. Данная методика успешно применена для  <Contrib> разработки, отладки и тестирования АСКУ ТО М (Автоматизированная система контроля и управления технологическим объектом во взрывозащищенном исполнении) </Contrib> ."
2019-17-4-11,Статья посвящена  <Contrib> разработке теоретической базы компьютерного моделирования данных диэлектрического каротажа </Contrib>  с целью  <Goal> обоснования нового импортозамещающего оборудования для каротажа нефтяных и газовых скважин </Goal> .  Разработаны алгоритмы и   <Contrib> реализованы быстрые программы компьютерного моделирования высокочастотных электромагнитных сигналов в рамках слоисто-однородных моделей сред  </Contrib> . По результатам   <Contrib> масштабного моделирования амплитудно-фазовых характеристик высокочастотного поля  </Contrib>   <Conc> установлена их зависимость от частотного спектра электрофизических параметров </Conc> . Проведенные исследования позволяют выполнить  <Use> научное обоснование и оптимальное проектирование новой электромагнитной зондирующей системы  </Use> .
2019-17-4-12," <Contrib> Представлен алгоритм для  <Task> численного моделирования динамики пучков в суперколлайдерах </Task>  </Contrib> . При взаимодействии высокоэнергетичных пучков возможна их деформация и разрушение, и  <Task> изучение устойчивости пучка  </Task> является актуальной задачей. <Contrib>  Рассматривается движение пучков в самосогласованных электромагнитных полях с учетом угла встречи в полностью трехмерном случае </Contrib> . Задача решается  <Method> методом частиц-в-ячейках </Method> .  <Adv> Распараллеливание по области и по частицам позволяет проводить численные эксперименты с 10^9 модельных частиц </Adv> . Приведены результаты моделирования и сравнение с существующим аналитическим решением."
2019-17-4-13,"Статья посвящена  <Contrib> описанию программной системы ИТОС (индивидуальных траекторий обучения студентов) </Contrib> , предназначенной для  <Use> автоматизации работы с основной образовательной программой (ООП) и соответствующим ей учебным планом </Use> . В системе  <Contrib> реализована возможность отслеживать логику следования учебных курсов </Contrib> , что позволяет на этапе составления ООП  <Use> выявлять необходимость перестановки или слияния дисциплин, а также достижимость всех заданных компетенций </Use> . Имеется возможность  <Use> устанавливать взаимосвязь между ООП и различными профессиональными стандартами </Use> . В системе  <Contrib> реализован алгоритм построения и оценки всевозможных индивидуальных траекторий обучения студента в рамках данной ООП </Contrib> , а также  <Contrib> модуль рекомендательной системы </Contrib> , помогающей пользователям (студентам) в  <Use> выборе индивидуальных траекторий обучения </Use> ."
2019-17-4-14, <Contrib> Рассматривается диффузионная модель для описания долговременной эволюции профиля глубин в прибрежной зоне </Contrib> . Для калибровки модели решалась обратная задача восстановления коэффициентов по дополнительным граничным условиям путем  <Method> минимизации функционала невязки </Method> . Многомерная оптимизация функционала проводилась  <Method> методом дифференциальной эволюции </Method> . Для вычисления профиля глубин применялся  <Method> метод конечных элементов </Method> . Тестирование проводилось на  <Example>  базе данных JARKUS  </Example>  при различных пространственных и временных интервалах.  <Adv> Достигнута относительная погрешность описания эволюции берегового профиля на уровне не более 5 % </Adv> .
2019-17-4-15, <Contrib> Рассмотрены вопросы выбора варианта реализации базы данных при разработке цифровых образовательных систем </Contrib> .  <Contrib> Проведен равнительный анализ реляционного и графового подходов к хранению базовых сущностей </Contrib> .  <Contrib> Продемонстрирован ряд преимуществ графовой модели в контексте удобства разработки и эффективности реализации запросов </Contrib> .
2018-16-3-1,"В теории информации известно, что методы сжатия данных могут быть использованы для прогнозирования стационарных процессов. В данной работе  <Contrib> предложен базирующийся на  <Tool> архиваторах </Tool>  алгоритм прогнозирования временных рядов </Contrib>  и проведено экспериментальное исследование его эффективности. В процессе работы описанного алгоритма могут быть использованы произвольные методы сжатия данных, причем прогнозные значения от разных методов комбинируются, и наибольшее влияние на конечный результат оказывает метод, способный сильнее других сжать временной ряд. Данный алгоритм может быть использован для  <Use> прогнозирования рядов с дискретными и непрерывными алфавитами </Use> . Для повышения точности прогноза возможно применение существующих методов предварительной обработки данных. Экспериментальное исследование эффективности предложенного алгоритма проводилось на временных рядах из M3 Competition и ряде T-индекса, при этом были использованы хорошо известные  <Tool> архиваторы </Tool> . Результаты вычислений показали, что полученный метод обладает сравнительно  <Adv>  высокой точностью  </Adv>  и  <Adv> быстродействием </Adv> ."
2018-16-3-2,"Статья посвящена решению проблемы  <Task> адаптации больших древовидных и линейных меню мобильных и интернет-услуг для различных типов пользователей на основании их интересов, социального статуса, а также иных параметров </Task> .  <Contrib> Разработана программная система, строящая оптимальное меню услуг для классов пользователей, разделенных по социально-экономическим и физическим параметрам </Contrib> , с использованием  <Method> модифицированного алгоритма построения оптимального графа USSD-меню </Method> . В работе используется  <Method> онтологический подход для формального представления понятий данной предметной области, извлечения, представления и обработки знаний </Method> . Для адаптации интерфейсов используются модели пользователей , представляющие описания их потребностей, целей, интересов. Формализация поведения пользователей осуществляется при помощи  онтологической модели мобильных и интернет-услуг. Каждого пользователя можно отнести к определенной модели на основании его физических и социальных параметров. Программа, реализующая адаптацию меню, состоит из двух модулей: модуль получения частот вызова услуг на основе запросов к онтологии и модуль оптимизации графа меню. Алгоритм оптимизации меню работает с  <Tool> языком описания графов DOT </Tool> ."
2018-16-3-3," <Contrib> Рассматриваются три подхода к  <Task> хранению информации о книгообеспеченности учебного процесса  </Task> при различных вариантах интеграции автоматизированной библиотечной информационной системы (АБИС) с информационной системой вуза: внутри АБИС в формате RUSMARC, в виде реляционной базы данных, с использованием  <Method> технологии OLAP </method>   </Contrib> .  <Contrib> Анализируются преимущества и недостатки каждого подхода </Contrib> ,  приводятся примеры организации хранения данных( <Example> поля RUSMARC </Example> ,  <Example> измерения и меры для кубов OLAP </Example> ) ."
