id,text
2019-17-2-13,"В данной статье рассматривается проблема  <Task> защиты от несанкционированного доступа к данным путем идентификации пользователей по биометрическим характеристикам, а именно, клавиатурному почерку </Task>  . Для решения этой задачи авторами была  <Contrib> проведена серия опытов для получения статистической выборки образцов клавиатурного почерка </Contrib> , которые используются в качестве биометрической характеристики для установления личности ее владельца. Для анализа данных и определения автора конкретного образца почерка в работе рассматривается  <Method> метод k-средних </Method> , являющийся одним из наиболее простых и эффективных статистических методов классификации в случае, когда число кластеров заранее известно. Оценка эффективности предложенного метода для решения поставленной задачи оценивается с помощью  <Method> коэффициентов ложного доступа и ложного отказа в доступе </Method> , которые являются основными характеристиками биометрических систем аутентификации. Полученные результаты позволяют сделать вывод о  <Conc> наличии ряда ограничений при использовании данного метода, возникающих в силу того, что данная задача является слабоформализуемой, зависящей от множества факторов, в том числе и не поддающихся математическому описанию, таких как нестабильность клавиатурного почерка, объясняемая изменением психофизиологического состояния пользователя, эргономичностью клавиатуры и т.д. </Conc>  Учитывая все вышеупомянутые особенности, дальнейшее решение задачи предлагается рассматривать в перспективе использования  методов, основанных на интеллектуальной обработке данных, которые позволяют обнаруживать в потоке данных скрытые закономерности и зависимости."
2019-17-3-1," <Contrib> Рассматриваются алгоритмы  <Task> построения триангуляции внутренней поверхности коронарных артерий сердца </Task>  по данным компьютерной томографии </Contrib> .  <Task> Точное определение геометрии сосудов </Task>  необходимо для  <Use> построения гидродинамической модели кровоснабжения сердца </Use>  и  <Use> расчета параметров кровотока с помощью уравнений Навье – Стокса </Use> . Для восстановления трехмерной геометрии применяется комбинация двух основных методов:  <Method> трехмерного алгоритма роста области из семени </Method>  и  <Method> ячеечного метода </Method> , использующего разбиение пространства на тетраэдры. При этом используется  <Tool> тетраэдрическая сеть </Tool> , предложенная в работах S. Chan, E. Purisima (1998) и V. Skala (2000), в которой тетраэдры строятся в кубической решетке на общих гранях смежных кубов. Эта сеть строится не на всем пространстве, а только в окрестности границы множества вокселей, вычисленного на первом этапе как результат применения трехмерного алгоритма роста области."
2019-17-3-2,"
Несмотря на большое количество существующих методов диагностики головного мозга, он остается наименее изученной частью человеческого организма. Электроэнцефалография (ЭЭГ)– один из наиболее популярных методов исследования мозговой активности. Это обусловлено относительной дешевизной, безвредностью и мобильностью оборудования. При анализе данных ЭЭГ возникает проблема решения  <Task> обратной задачи электроэнцефалографии – локализации источников электрической активности мозга </Task> . Ее можно сформулировать следующим образом: по сигналам, регистрируемым на поверхности головы, необходимо определить, в какой области мозга расположены источники этих сигналов. Целью исследования является  <Goal> разработка программной системы для локализации источников мозговой активности на основе совместного анализа данных ЭЭГ и сМРТ </Goal> . Существуют различные подходы к решению  <Task>  обратной задачи ЭЭГ  </Task> . Для получения наиболее точных результатов некоторые из них предполагают использование данных сМРТ (изображений структурной магнитнорезонансной томографии) , описывающих индивидуальную анатомию головы человека. В этой работе используется один из таких подходов –  <Method> EMSICA (Electromagnetic Spatiotemporal Independent Component Analysis) </Method> , предложенный A. Tsai. В статье  <Contrib>  рассмотрены основные этапы работы системы  </Contrib> , такие как предварительная обработка исходных данных; расчет специальной матрицы подхода EMSICA, значения которой показывают уровень активности определенного участка мозга; визуализация источников активности мозга на его трехмерной модели."
2019-17-3-3,"Статья посвящена  <Contrib> разработке методов  <Task> порождения новых знаний на основе анализа текстов естественного языка </Task>   </Contrib> . Для  <Task> извлечения знаний из текстов на естественном языке </Task>  используется  <Method> метод представления предложений в виде двухместных предикатов с введенной константой ситуацией </Method> . Для  <Task> представления знаний в формальном виде </Task>  используются  <Method> бескванторные предложения логики предикатов </Method> , а также  <Tool> язык OWL DL </Tool> .  <Task> Порождение новых знаний  </Task> реализуется при помощи автоматических средств логического вывода с использованием заранее заданных  <Method> шаблонов правил вывода </Method> . Разработана программная система, которая дает возможность пользователям получать ответы на определенные вопросы, относящиеся к данным текстам естественного языка. Ответы строятся на естественном языке при этом  <Adv> используются не только явно содержащиеся в обрабатываемом документе знания, но и знания, порожденные при помощи автоматических средств логического вывода </Adv> ."
2019-17-3-4,"Музыкальная рекомендательная система (МРС) помогает пользователям музыкальных стриминговых сервисов  <Use> находить интересующий их музыкальный контент  </Use> . Разреженность пользовательских оценок – одна из главных проблем исследования МРС. Она вызвана тем, что пользователь оценивает лишь малую долю объектов музыкального каталога. В результате МРС часто не обладает достаточным набором данных для составления рекомендаций. В статье  <Contrib>  предложен подход для решения проблемы разреженности пользовательских оценок на основе использования оценок связанных объектов </Contrib> .   <Contrib> Описана гибридная МРС, использующая как нормализованные пользовательские оценки треков, альбомов, артистов, жанров, так и информацию о связях между объектами разных типов </Contrib> . Произведена оценка эффективности разработанной МРС, а также произведен сравнительный анализ предложенного подхода с коллаборативным методом предсказания пользовательских предпочтений."
2019-17-3-5,"Статья посвящена  <Contrib> разработке автоматизированных методов  <Task> интеграции знаний, извлеченных из текстов естественного языка </Task>   </Contrib> . Для решения этой задачи используются  <Method> методы преобразования предложений естественного языка во фрагменты атомарных диаграмм </Method> . Знания, извлеченные из текстов, формализуются при помощи атомарных предложений сигнатуры, состоящей из символов констант, двухместных предикатов и дополнительных констант-ситуаций.  <Contrib> Разработаны методы интеграции знаний, содержащихся в нескольких предложениях естественного языка, позволяющие учитывать их семантические контексты </Contrib> ."
2019-17-3-6,"В последнее время увеличивается количество окружающих нас электронных приборов, возрастает и их техническая сложность. В то же время инструкции к данным приборам читает только малая часть людей. Также возможны ситуации, когда инструкции или специалиста нет рядом с устройством. Поэтому часто встречаются случаи неправильного использования техники. В связи с этим закономерно встает задача   <Task> быстрого распознавания типа устройства с последующим выводом информации о данном устройстве  </Task> . В работе описывается процесс  <Contrib> реализации системы распознавания типа устройства с использованием  <Method> методов машинного обучения </Method> , с последующим выводом на экран его основных заранее отобранных характеристик и отображением пользователю набора вероятных инструкций для данного типа устройств </Contrib> . Поскольку направлением данной работы является  <Task> нахождение похожих объектов </Task> , а также их  <Task> классификация на основе информации о внешнем представлении объекта </Task> , то рассматриваются  <Method> алгоритмы получения признаков объекта из его изображения </Method> . В статье  <Contrib> предлагается подход получения определяющих признаков объекта на основе его внешнего представления (контуров) </Contrib> ."
2019-17-3-7,"Статья посвящена  <Contrib> методике автоматизированного тестирования системы автоматической оценки заданий по программированию NSUts </Contrib> . При разработке методики главным приоритетом было параллельное тестирование старой и новой версий приложения так, чтобы одни и те же или минимально модифицированные тесты проходили на двух версиях системы с различными архитектурами. Мы надеемся, что наш опыт будет полезен при  <Use> выстраивании процесса разработки других приложений с длительным жизненным циклом </Use> . Чтобы тестировать не только серверную, но и клиентскую часть веб-приложения, мы предлагаем использовать инструменты типа  <Tool> Selenium WebDriver </Tool>  для симуляции действий пользователей, посылая команды настоящим браузерам. В методике применяется известный  <Tool> шаблон проектирования Page Object </Tool>  и  <Contrib> рассматривается ряд приемов, позволяющих снизить хрупкость разрабатываемых тестов и упростить их адаптацию для работы с новой версией системы </Contrib> . В статье также описано применение данной методики для  <Use> организации тестирования системы NSUts </Use>  и проведен анализ ее эффективности. Анализ показал, что оценочное покрытие кода данными тестами достаточно высоко, и потому  <Adv> методику можно считать эффективной и применять на схожих веб-приложениях </Adv> ."
2019-17-3-8,"Статья посвящена  <Contrib> разработке методов  <Task> поиска информации в Интернете </Task>  </Contrib> . В настоящее время задача  <Task> быстрого автоматизированного извлечения данных из различных источников </Task>  является чрезвычайно актуальной. Цель данной работы –  <Goal> создание инструментария для решения этой задачи </Goal> . Идея подхода заключается в  <Contrib> разработке полуавтоматических методов составления лингвистических шаблонов для заданного фрагмента атомарной диаграммы </Contrib> . Процесс построения шаблонов по данному фрагменту атомарной диаграммы выполняется в 2 этапа: 1) порождение простых шаблонов; 2) с помощью полученных простых шаблонов создание более сложных или реже встречающихся шаблонов. С помощью полученных шаблонов можно  <Use> находить необходимую информацию, обрабатывая тексты естественного языка, представленные в Интернете </Use> ."
2019-17-3-9,"В статье приводится  <Contrib>  обзор проектов, технологий, программных продуктов, разрабатываемых для реализации идей объектно-ориентированного подхода к проектированию баз данных  </Contrib>  . В 1980-е гг. велось множество проектов, посвященных идее ООБД, многие специалисты ожидали, что в ближайшее время реляционные базы данных будут вытеснены объектно-ориентированными. Несмотря на впечатляющее количество проектов, проводимых как коллективами ученых, так и коммерческими компаниями, ориентированными на практическое внедрение, не появилось четкой формулировки объектно-ориентированной модели данных, каждый коллектив представлял свое видение применения принципов ООП к проектированию баз данных. Отсутствие универсальной модели данных с проработанным математическим аппаратом (как в случае реляционных баз данных) и сегодня является основной проблемой распространения ООСУБД. Однако применение реляционных СУБД порождает ряд проблем, которые наиболее остро ощущаются в таких областях, как системы автоматизированного проектирования, автоматизированное производство, системы, основанные на знаниях, и др. ООБД позволяют объединить программный код и данные, избежать различий между представлениями информации в базе и прикладной программе, вследствие чего интерес к ним проявляют современные разработчики.  <Conc>  Современный рынок программного инструментария представлен рядом ООСУБД, но ни одна из них не может конкурировать с крупнейшими поставщиками СУБД  </Conc> ."
2019-17-4-1,"Моделирование – неотъемлемая часть исследования процессов распространения сейсмических волн в различных средах. Широко используемый способ разбиения области на прямоугольные ячейки обладает недостатком: при сложном строении свободной поверхности (например, гора) возникают эффекты при отражении волны от этой поверхности, связанные с тем, что граница аппроксимируется ступенчатой функцией для численного решения задачи. В данной работе предложен иной подход к  <Task>  дискретизации области  </Task> :  <Method> построение криволинейной сетки </Method> , хорошо согласующейся с геометрией свободной поверхности.  <Contrib> Предложен алгоритм численного моделирования </Contrib>  на основе  <Method> численного решения линейной 2D-системы теории упругости </Method> , записанной в смещениях, с использованием  <Tool> криволинейной сетки </Tool>  и  <Method> пошагового метода Лагерра </Method> . Представлены результаты моделирования. Также были  <Contrib>  реализованы две параллельные версии алгоритма </Contrib> ,  <Contrib> проведены расчеты на различных многоядерных системах </Contrib>  (на  <Tool> классической многопроцессорной архитектуре </Tool> , а также  <Tool> архитектуре с использованием сопроцессоров Intel Xeon Phi – ""РСК ПетаСтрим"" </Tool> ).  <Contrib> Представлены сравнительные тесты ускорений на разных архитектурах </Contrib> , а также  <Contrib> описаны особенности распараллеливания алгоритма </Contrib> ."
2019-17-4-2," <Contrib> Рассматривается новый способ  <Task> извлечения понятий из текстов предметной области </Task>  </Contrib>  на основе комбинации  <Method> анализа формальных понятий </Method>  и  <Method> бутстрап-технологии информационного поиска </Method> .  <Task> Анализ формальных понятий </Task>  представляет собой мощный аппарат автоматического вывода понятий предметной области, однако он рассчитан на высокое качество входных данных, без пропусков и неточностей. Получение таких наборов данных напрямую из текстов затруднено в силу сильной разреженности текстовых корпусов. Соответственно, представляется перспективным  <Task> улучшение качества входных данных </Task>  за счет применения  <Method> бутстраппинга </Method>  – технологии, обеспечивающей интеллектуальный поиск фрагментированной информации в сети Интернет. Цель данной работы –  <Goal> показать, что при правильном выборе исходных шаблонов поиска бутстраппинг, основанный на использовании открытых ресурсов Интернета как ценных источников знаний, превращается в эффективный инструмент поддержки концептуального моделирования </Goal> ."
