id,text
2018-16-3-4,"Статья посвящена  <Contrib> разработке методов  <Task> извлечения из текстов естественного языка определений ключевых понятий предметной области </Task>  </Contrib>  на основе  <Method> теоретико-модельного подхода </Method> . Извлеченная из текстов информация путем  <Method> преобразования через фрагменты атомарных диаграмм алгебраических систем </Method>  представляется в виде утверждений в логике описаний (DL). Подобное представление  <Adv> позволяет получать тексты с большей выразительностью </Adv> по сравнению с алгоритмами, где источником информации являются данные, представленные в виде баз данных или в виде выражений на формализованных языках (например, SQL)."
2018-16-3-5," <Contrib> Исследуются возможности бесконтактных систем и интерфейсов, главные принципы работы с такими технологиями </Contrib> . Рассмотрена возможность применения подобных систем для  <Use> упрощения взаимодействия пользователей с ограничениями возможностями здоровья с компьютерным интерфейсом </Use> .  <Contrib> Приведены особенности и преимущества использования естественных интерфейсов и систем, основанных на жестовом управлении </Contrib>  Также детально  <Contrib> рассмотрены этапы формирования базового словаря жестов </Contrib>  для дальнейшего его применения в  <Use> бесконтактном интерфейсе </Use> . В качестве дополнительного аппаратного обеспечения для получения более точных результатов распознавания таких жестов рассмотрено  <Tool> устройство Microsoft Kinect </Tool> ."
2018-16-3-6,"В ходе научных исследований порождается большое количество данных в цифровом формате, и для после- дующего использования этих данных (обработки, анализа, публикации) их необходимо организованно собирать и хранить.  <Task> Построение информационной инфраструктуры для решения этих задач </Task>  – одна из наиболее актуальных проблем в области организации работы с экспериментальными данными. Авторами настоящей статьи  <Contrib> разрабатывается информационная система для автоматизации сбора, хранения и анализа данных </Contrib> , в качестве отправной точки для которой используются три задачи обработки данных из области физиологии. Рассмотрены и проанализированы возникающие в процессе разработки такой системы проблемы, а также существующие подходы и готовые решения этих и схожих задач . На основе результатов проведенного анализа  <Contrib> предложен ряд моделей и механизмов для решения возникших проблем </Contrib> . Разработанные решения включают в себя модели и механизмы сбора и хранения экспериментальных данных, модель для описания и формализации сценариев обработки данных и механизмы для обработки собранных данных в распределенной вычислительной системе. В результате  <Contrib> представлена архитектура вычислительной системы для сбора, хранения и обработки экспериментальных данных </Contrib> . Система предлагается в качестве инструмента для  <Use> решения широкого спектра задач, возникающих при проведении научных исследований и требующих сбора, хранения и многоэтапной обработки различных типов данных </Use> ."
2018-16-3-7," <Contrib> Описан новый метод  <Task> автоматического реферирования текстов </Task>  </Contrib> . На основе предложенного метода  <Contrib> создана система, позволяющая получать краткие аннотации научно-технических текстов и определять их темы </Contrib> . Процесс реферирования состоит из пяти основных шагов: предобработка, риторический анализ и преобразование текста, оценка весов, выбор предложений и сглаживание. Предлагаемый метод формирует аннотацию на основе наиболее значимых предложений исходного документа. Значимость предложений частично определяется в процессе риторического анализа, который выполняется с помощью дискурсивных маркеров и коннекторов. Также учитываются ключевые слова, многословные термины и некоторые специальные слова, которые часто встречаются в научно- технических текстах. Для извлечения ключевых слов и определения тем текста применялась  <Method> аддитивная регуляризация тематических моделей </Method> ."
2018-16-3-8,"Статья посвящена  <Contrib> разработке системы управления фертигацией </Contrib> , которая позволяет осуществлять автоматическую подачу удобрений с учетом показателей pH и EC, полученных от соответствующих датчиков. Для решения этой задачи  <Contrib> разработан модуль минерализации </Contrib> , состоящий из двух подмодулей: подмодуль измерения и регулирования pH и подмодуль измерения и регулирования EC. Данные передаются микроконтроллеру для дальнейших действий по управлению системой. В качестве системы принятия решений в работе использована  <Tool> интеллектуальная система на основе нечеткой логики </Tool> ."
2018-16-3-9," <Task> Исследование регуляции транскрипции генов на основе данных современных технологий высокопроизводительного секвенирования </Task>  является актуальной задачей биоинформатики, требующей развития новых компьютерных средств, в том числе на основе суперкомпьютерных вычислений.  <Contrib> Рассмотрены задачи обработки данных полногеномных профилей ChIP-seq связывания транскрипционных факторов в геномах, определения пиков профилей и поиска сайтов связывания в нуклеотидных последовательностях таких пиков </Contrib> .  <Contrib> Разработаны программы для анализа положения сайтов связывания в геноме относительно районов генов, расчета кластеров таких сайтов и визуализации их положения в геноме </Contrib> .  <Contrib> Рассчитаны кластеры сайтов связывания транскрипционных факторов в геноме человека </Contrib>  по базе данных Cistrome,  <Contrib> построены матрицы совместной встречаемости пар сайтов связывания различных транскрипционных факторов в геноме для различных типов тканей и культур клеток </Contrib> .  <Contrib> Проведен вычислительный эксперимент по компьютерной генерации случайных кластеров в геноме, а также оценке встре- чаемости кластеров большого размера для экспериментально полученных сайтов связывания транскрипционных факторов в геноме человека </Contrib> .  <Contrib> Найдены закономерности встречаемости сайтов факторов плюрипотентности в эмбриональных стволовых клетках </Contrib> . Разработанное программное обеспечение доступно по запросу к авторам"
2018-16-3-10,"Современные методы экспериментальных исследований позволяют реконструировать различного типа биологические сети, включая генные и метаболические сети, сети интерактомики, сети коэкспрессии генов, сети заболеваний и т. д. В данной статье  <Contrib> представлена разработанная нами система построения структурных моделей биологических сетей в виде набора случайных графов, структурные закономерности которых совпадают со структурными закономерностями исходной биологической сети </Contrib> . Такие структурные модели могут быть использованы для  <Use> проверки различных статистических гипотез на сетях </Use> , в  <Use> исследовании влияния структурных закономерностей в биологических сетях на их функцию </Use>  и других задачах. При генерации структурных моделей в случайных графах могут быть зафиксированы следующие характеристики: распределение степеней вершин, попарное распределение степеней вершин, средняя степень соседних вершин, коэффициент кластеризации, спектр кластеризации, частота структурных мотивов различных размеров и др. Разработанная система построена по архитектуре клиент-сервер и состоит из плагина Cytoscape и удаленного вычислительного сервиса. Взаимодействие между клиентом и сервером реализовано посредством  <Tool> фреймворка gRPC </Tool>  с применением  <Tool> протокола сериализации структурированных данных Protocol Buffers </Tool> . Система позволяет асинхронно конструировать структурные модели заданных биологических сетей в виде случайных графов посредством программ  <Tool> Random Network Generator </Tool>  и  <Tool> GTrie Scanner </Tool> . Результат построения может быть загружен для визуализации и анализа средствами пакета Сytoscape. С использованием разработанной системы  <Contrib> проведен вычислительный эксперимент по реконструкции структурных моделей ряда биологических сетей </Contrib> , для которых удалось построить алгоритм предсказания времени расчетов структурных моделей."
2018-16-3-11,"Современные постгеномные методы изучения экспрессии генов с помощью транскриптомного профилирования имеют большое значение для фундаментальных биомедицинских исследований в онкологии, поиска новых маркеров развития опухолей на культурах клеток глиом. Такие эксперименты требуют  <Task> разработки новых компьютерных инструментов анализа объемных данных секвенирования </Task> . Цель представленного исследования –  <Goal> компьютерный поиск генов и их изоформ </Goal> , нарушение экспрессии которых связано с развитием глиобластом, с помощью современных высокопроизводительных технологий секвенирования транскриптом и международных биомедицинских банков данных.  <Task> Поиск генов – кандидатов для терапевтического воздействия в опухолях, в том числе отдельных изоформ генов </Task> , актуален в  <Use> здравоохранении </Use>  и  <Use> современной высокотехнологичной медицине </Use> . В данной работе представлены задачи биоинформатики, связанные с  <Contrib> разработкой компьютерных конвейеров обработки транскриптомных данных </Contrib> ,  <Contrib> определения дифференциально экспрессирующихся генов </Contrib> ,  <Contrib> анализа альтернативного сплайсинга </Contrib> ,  <Contrib> описания категорий генных онтологий для найденных групп генов </Contrib> . Рассмотрены задачи  <Contrib> автоматического поиска и описания функций генов в связи с раковыми заболеваниями </Contrib> ,  <Contrib> визуализации результатов и разработки биомедицинских баз данных </Contrib> .  <Contrib> Представлен прототип базы данных дифференциального альтернативного сплайсинга генов – «Дифференциальный альтернативный сплайсинг генов человека при вторичной глиобластоме (ДАСГГ)» </Contrib> , с возможностью работы через веб-сайт, поиска уровней экспрессии отдельных изоформ в глиальной опухоли"
2018-16-3-12," <Task> Разработка и применение компьютерных средств анализа транскриптомных данных в модельных организмах животных  </Task>  представляет актуальную задачу биоинформатики. Задача  <Task> исследования экспрессии генов современными методами высокопроизводительного секвенирования в отделах мозга лабораторных животных </Task>  является исключительно важной для изучения генетических основ поведения в целом.  <Task> Изучение генетических детерминант агрессивного поведения </Task>  не только сохраняет актуальность для исследования молекулярных механизмов регуляции поведения, но и имеет широкую практическую составляющую при работе с животными, для  <Use> решения задач агробиологии </Use> . Наследственная предрасположенность животных к агрессивному поведению приводит к появлению различий в строении головного мозга, и сравнение таких различий позволит найти как общие, так и специфичные механизмы регуляции поведения, способствующие проявлению агрессии в провоцирующих условиях среды.  <Contrib> Представлены компьютерные программы анализа сплайсинга и прототип базы данных экспрессии генов в отделах мозга лабораторных животных </Contrib>  – серых крыс, селектированных по проявлению агрессивного поведения.  <Contrib> Выполнена функциональная аннотация генов с повышенной и пониженной экспрессией в экспериментах на крыса </Contrib> , <Contrib>  рассмотрены варианты изоформ и альтернативного сплайсинга этих генов </Contrib> ."
2018-16-2-1,"Фонд оценочных средств является составной частью нормативно-методического обеспечения системы оценки качества освоения студентом учебного материала.  <Method> Онтологический подход к моделированию фонда оценочных средств </Method>  позволяет формировать актуальные оценочные документы, которые учитывают не только всевозможные пожелания экзаменатора, но и степень усвоения различных компетенций и степень овладения различными профессиональными функциями. В статье  <Contrib> приведено описание онтологии, семантической и нечеткой моделей фонда оценочных средств </Contrib> .   <Contrib> Описан алгоритм порождения шаблона оценочного документа </Contrib> , состоящий из трех этапов: сужение, ограничение и определение. На каждом этапе генерируется соответствующая нечеткая модель, в рамках которой проверяется непротиворечивость заданного шаблона и выполнимость данного шаблона на имеющейся базе оценочных средств. Для формирования комплекта оценочных документов используется  <Method> алгоритм CLOPE </Method> , позволяющий кластеризовать категорийные данные."
2018-16-2-2," <Contrib> Предложен алгоритм автоматизации  <Task> построения трехмерных геоэлектрических моделей </Task>  для метода зондирования становлением поля в ближней зоне </Contrib>  на основе результатов одномерной инверсии с целью  <Goal> расчета синтетических сигналов для трехмерных моделей </Goal> , а также  <Goal> ускорения получения качественной оценки полевых материалов </Goal>  и  <Goal> сведения к минимуму ошибок интерпретации </Goal> . Важной частью алгоритма является автоматическое формирование трехмерных расчетных сетей, необходимых для расчета синтетических сигналов в моделях. Результаты работы алгоритма представляют собой  <Contrib> подготовленные трехмерные модели изучаемой среды с рассчитанным синтетическим электромагнитным сигналом </Contrib> . Алгоритм апробирован на данных электромагнитного мониторинга последствий землетрясения, произошедшего в 2003 г. в Республике Алтай."
